{
  "event_id": "22222222-2222-4222-8222-222222222222",
  "event_type": "freeze.written",
  "occurred_at": "2026-08-26T01:00:01Z",
  "producer": "afd",
  "correlation_id": "corr-fee-1",
  "session_id": "chat-11111111-1111-4111-8111-111111111111",
  "decision_id": "dec-fee-1",
  "payload": {
    "route_id": "fee_explain",
    "route_version": "2026.08.1",
    "ingress": "chat",
    "freeze_key": "chat-11111111-1111-4111-8111-111111111111"
  }
}
