{
  "event_id": "11111111-1111-4111-8111-111111111111",
  "event_type": "decide.completed",
  "occurred_at": "2026-08-26T01:00:00Z",
  "producer": "adp",
  "correlation_id": null,
  "session_id": "sess-88",
  "decision_id": "dec-fee-1",
  "payload": {
    "outcome": "route",
    "route_id": "fee_explain",
    "route_version": "2026.08.1",
    "candidates": ["fee_explain"],
    "router_layer": "retrieve",
    "claims_hash": "sha256:aaaaaaaaaaaaaaaaaaaaaaaaaaaaaaaaaaaaaaaaaaaaaaaaaaaaaaaaaaaaaaaa",
    "utterance_hash": "sha256:bbbbbbbbbbbbbbbbbbbbbbbbbbbbbbbbbbbbbbbbbbbbbbbbbbbbbbbbbbbbbbbb",
    "channel": "web",
    "ingress": "chat"
  }
}
